<?xml version="1.0" encoding="UTF-8"?>
<!DOCTYPE fif SYSTEM "file:/D:/Documents/ASP/AspProject_YoanaBoyanova_71540_sourceCode/XML_Files/cat_breeds.dtd">
<fif>
  <cat_breeds>
    <cat_breed standart_number="RUS" group="groupC" category="cat4">
      <name>Синя руска</name>
      <country capital="Москва" official_language="руски" time_zone="UTC/GMT  -2 hours" currency="" country_code="RUS">
        <country_name>Русия</country_name>
        <country_continent>Европа</country_continent>
        <country_government_type></country_government_type>
      </country>
      <year_of_establishment>1949</year_of_establishment>
      <head>Има сравнително къса клинообразна глава, прав нос, големи заострени уши, широки в основата си, отвесно поставени. </head>
      <ears> големи уши са разположени отгоре на сравнително малката им яйцевидна главица </ears>
      <eyes> Очите са големи и изразителни, широко поставени, с бадемовидна форма и зелено обагряне. Крайниците са високи и елегантни.</eyes>
      <tail>Има овални лапи и сравнително дълга островърха опашка. </tail>
      <colors>
        <primary_color>сиво-синя</primary_color>
        <secondary_color>черна</secondary_color>
        <prefered_color>червена</prefered_color>
      </colors>
      <fur> Но най-красивата породна особеност е равномерното сиво-синьо оцветяване на козината, която е копринсномека (плюшоподобна), с къси, гъсти, нежни и меки косми с подкосмие, което има еднаква дължина с покривните косми. </fur>
      <image>http://www.kotkite.com/img/articles/thumbs/2807071245_6_.jpg</image>
      <size>
        <males_size>6</males_size>
        <females_size>5</females_size>
      </size>
      <personality>Има овални лапи и сравнително дълга островърха опашка. </personality>
    </cat_breed>
  </cat_breeds>
  <categories>
    <category category_id="cat4">напълно разпознати котки - 4</category>
  </categories>
  <groups>
    <group group_code="groupC">късокосмести котки</group>
  </groups>
</fif>