<?xml version="1.0" encoding="UTF-8"?>
<!DOCTYPE fif SYSTEM "file:/D:/Documents/ASP/AspProject_YoanaBoyanova_71540_sourceCode/XML_Files/cat_breeds.dtd">
<fif>
  <cat_breeds>
    <cat_breed standart_number="MAN" group="groupC" category="cat3">
      <name>Манкс</name>
      <country capital="Токио" official_language="японски" time_zone="UTC/GMT  +9 hours" currency="японска йена" country_code="JAP">
        <country_name>Япония</country_name>
        <country_continent>Азия</country_continent>
        <country_government_type>република</country_government_type>
      </country>
      <year_of_establishment>1949</year_of_establishment>
      <head>Главата е кръгла, но е по-дълга, отколкото широка.</head>
      <ears>Широко поставените уши са със среден размер, широки в основата и постепенно изтъняващи и закръглени накрая.</ears>
      <eyes>Очите са много кръгли и широко поставени, под лек наклон към носа.</eyes>
      <tail>1.Тип rumру (код 51) - няма опашни прешлени и е налице пълна липса на опашка, като има вдлъбнатина на мястото на липсващата опашка, която се констатира с поставяне на палеца;
			2.Тип rumpy-riser (код 52) - с малко опашни прешлени, които обикновено са свързани неподвижно - представлява къс изправен израстък;
			3.Тип stumpy (код 53) - остатъчна къса опашка с деформации (удебеления);
			4.Тип longy (код 54) - опашката се доближава до нормалната дължина, но е видимо по-къса.</tail>
      <colors>
        <primary_color>сребриск</primary_color>
        <secondary_color>златист</secondary_color>
        <prefered_color>бял</prefered_color>
      </colors>
      <fur>къса</fur>
      <image>http://www.kotkite.com/img/articles/thumbs/0208070837_6_.jpg</image>
      <size>
        <males_size>5</males_size>
        <females_size>4</females_size>
      </size>
      <personality></personality>
    </cat_breed>
  </cat_breeds>
  <categories>
    <category category_id="cat3">напълно разпознати котки 3</category>
  </categories>
  <groups>
    <group group_code="groupC">късокосмести котки</group>
  </groups>
</fif>