<?xml version="1.0" encoding="UTF-8"?>
<!DOCTYPE fif SYSTEM "file:/D:/Documents/ASP/AspProject_YoanaBoyanova_71540_sourceCode/XML_Files/cat_breeds.dtd">
<fif>
  <cat_breeds>
    <cat_breed standart_number="BSS" group="groupB" category="cat3">
      <name>Британска късокосместа</name>
      <country capital="Лондон" official_language="английски" time_zone="UTC/GMT  -2 hours" currency="паунд" country_code="GBR">
        <country_name>Великобритания</country_name>
        <country_continent>Европа</country_continent>
        <country_government_type>кралство</country_government_type>
      </country>
      <year_of_establishment>1960</year_of_establishment>
      <head>Главата на тази котка е кръгла, масивна, с широк череп, поставена на отлично развита къса и силна шия.</head>
      <ears> Ушите й са малки и широки в основата, леко закръглени, широко поставени като подчертават закръглените контури на главата.  </ears>
      <eyes>Очите на британската късокосместа котка са големи, кръгли, широко поставени. Цветът им е в съответствие с очите.</eyes>
     
      <colors>
        <primary_color>синя</primary_color>
        <secondary_color></secondary_color>
        <prefered_color></prefered_color>
      </colors>
      <fur>Козината на британската късокосместа котка е къса, плътна, неприлепваща, с гъст подкосъм.</fur>
      <image>http://www.catbg.net/domashni/pictures/Porodi/british_short/british3.jpg</image>
      <size>
        <males_size>8</males_size>
        <females_size>4</females_size>
      </size>
      <personality>Британките са контактни и комуникативни, дружелюбни и ласкави. </personality>
    </cat_breed>
  </cat_breeds>
  <categories>
    <category category_id="cat3">напълно разпознати котки 3</category>
  </categories>
  <groups>
    <group group_code="groupB">екзотични котки</group>
  </groups>
</fif>