<?xml version="1.0" encoding="UTF-8"?>
<!DOCTYPE fif SYSTEM "file:/D:/Documents/ASP/AspProject_YoanaBoyanova_71540_sourceCode/XML_Files/cat_breeds.dtd">
<fif>
  <cat_breeds>
    <cat_breed standart_number="SIA" group="groupD" category="cat4">
      <name>Сиамска котка</name>
      <country capital="Банкок" official_language="тайски" time_zone="UTC/GMT  +7 hours" currency="тайландки бат" country_code="THL">
        <country_name>Тайланд</country_name>
        <country_continent>Азия</country_continent>
        <country_government_type>кралство</country_government_type>
      </country>
      <year_of_establishment>1949</year_of_establishment>
      <head> Новият стандарт включвал лека костна система и клиновидна глава.</head>
      <ears>Ушите са големи и прави, разположени далече едно от друго, широки в основата си. </ears>
      <eyes>Очите са с бадемовидна форма, сапфиреносини на цвят.</eyes>
      <tail>Опашката е права, заострена накрая, без възли и дефекти по нея. </tail>
      <colors>
        <primary_color>сиамска с кафяви отмети</primary_color>
        <secondary_color>сиамска със сини отмети</secondary_color>
        <prefered_color>сиамска с лилави отмети</prefered_color>
      </colors>
      <fur>къса</fur>
      <image>http://www.kotkite.com/img/articles/thumbs/0208070837_6_.jpg</image>
      <size>
        <males_size>5</males_size>
        <females_size>4</females_size>
      </size>
      <personality></personality>
    </cat_breed>
  </cat_breeds>
  <categories>
    <category category_id="cat4">напълно разпознати котки 4</category>
  </categories>
  <groups>
    <group group_code="groupD">редки котки</group>
  </groups>
</fif>