<?xml version="1.0" encoding="UTF-8"?>
<!DOCTYPE fif SYSTEM "file:/D:/Documents/ASP/AspProject_YoanaBoyanova_71540_sourceCode/XML_Files/cat_breeds.dtd">
<fif>
  <cat_breeds>
    <cat_breed standart_number="CRX" group="groupC" category="cat4">
      <name>Корниш рекс</name>
      <country capital="Лондон" official_language="английски" time_zone="UTC/GMT  -2 hours" currency="паунд" country_code="GBR">
        <country_name>Великобритания</country_name>
        <country_continent>Европа</country_continent>
        <country_government_type>кралство</country_government_type>
      </country>
      <year_of_establishment>1950</year_of_establishment>
      <head>
      </head>
      <ears> големи уши са разположени отгоре на сравнително малката им яйцевидна главица </ears>
      <eyes> големи изразителни очи, леко косо, широко поставени, с наситен плътен цвят в съответствие с този на козината.</eyes>
      <tail>Имат дълга, тънка, много гъвкава и подвижна опашка, която равномерно изтънява към върха си.</tail>
      <colors>
        <primary_color>охра</primary_color>
        <secondary_color>черна</secondary_color>
        <prefered_color>червена</prefered_color>
      </colors>
      <fur>Заради късата им и фина козина, която не линее, много хора считат корниш рекс за хипоалергенни котки. </fur>
      <image>http://www.catbg.net/domashni/pictures/Porodi/cornish_rex/sleeping_cornish.jpg</image>
      <size>
        <males_size>6</males_size>
        <females_size>5</females_size>
      </size>
      <personality>Имат дълга, тънка, много гъвкава и подвижна опашка, която равномерно изтънява към върха си.</personality>
    </cat_breed>
  </cat_breeds>
  <categories>
    <category category_id="cat4">напълно разпознати котки - 4</category>
  </categories>
  <groups>
    <group group_code="groupC">късокосмести котки</group>
  </groups>
</fif>