<?xml version="1.0" encoding="UTF-8"?>
<!DOCTYPE fif SYSTEM "file:/D:/Documents/ASP/AspProject_YoanaBoyanova_71540_sourceCode/XML_Files/XML_Files/cat_breeds.dtd">
<fif>
    <cat_breeds>
        <cat_breed standart_number="EXO" group="groupA" category="cat1">
            <name>Екзотична котка</name>
            <country capital="Вашингтон" country_code="USA">
                <country_name>САЩ</country_name>
                <country_continent>Северна Америка</country_continent>
                <country_government_type>република</country_government_type>
            </country>
            <head>
                Главата на екзотичната котка е със среден размер и е с кръгла форма. Муцуната е леко сплескана като на персийската котка.
            </head>
            <ears>
                ушите са малки и са насочени надолу
            </ears>
            <eyes>
                Очите са големи, намират се на разстояние едно от друго и са много изразителни. Те са жълти или сини на цвят. 
            </eyes>
            <tail>Опашката на екзотичната котка не е много голяма и се стеснява към края си.</tail>
            <year_of_establishment>1966</year_of_establishment>
            <colors>
                <primary_color>кафяв</primary_color>
                <secondary_color>черен</secondary_color>
                <prefered_color>бял</prefered_color>
            </colors>
            <fur>Козината е къса и мека като кадифе, под основния слой има по-къс слой козина. </fur>
            <image></image>
            <size>
                <males_size>5</males_size>
                <females_size>4</females_size>
            </size>
            <personality>
                Екзотичната котка има доброжелателен и спокоен характер. Основното, което ги отличава от флегматичните персийски котки, е тяхната любознателност. 
            </personality>
        </cat_breed>
    </cat_breeds>
    <categories>
        <category category_id="cat1">Напълно разпознати породи - категория 1</category>
    </categories>
    <groups>
        <group group_code="groupA">EXO, PER</group>
    </groups>
</fif>