<?xml version="1.0" encoding="UTF-8"?>
<!DOCTYPE fif SYSTEM "file:/D:/Documents/ASP/AspProject_YoanaBoyanova_71540_sourceCode/XML_Files/cat_breeds.dtd">
<fif>
  <cat_breeds>
    <cat_breed standart_number="ABY" group="groupC" category="cat4">
      <name>Абисинска котка</name>
      <country capital="Лондон" official_language="английски" time_zone="UTC/GMT  -2 hours" currency="паунд" country_code="GBR">
        <country_name>Великобритания</country_name>
        <country_continent>Европа</country_continent>
        <country_government_type>кралство</country_government_type>
      </country>
      <year_of_establishment>1949</year_of_establishment>
      <head>Главата й е средно широка, леко клиновидна на изящна дълга шия. Муцуната й не е заострена</head>
      <ears>Ушите й са широко поставени, големи в основата си; имат формата на чаша и завършват със снопчета козина на върха. </ears>
      <eyes>Очите й са с бадемовидна форма, широко поставени под съвсем малък ъгъл спрямо носа и много изразителни. Обградени са с фин тъмен контур. </eyes>
      <tail>Опашката е плътна, с дълги косми.</tail>
      <colors>
        <primary_color>охра</primary_color>
        <secondary_color>черна</secondary_color>
        <prefered_color>червена</prefered_color>
      </colors>
      <fur>Козината й е къса, тънка, блестяща (копринена) и плътно прилепнала към тялото с наситен, равномерен основен цвят и ясно изразен тикинг. </fur>
      <image>http://www.catbg.net/domashni/pictures/Porodi/aby/Abyssinian2_web.jpg</image>
      <size>
        <males_size>6</males_size>
        <females_size>5</females_size>
      </size>
      <personality>Опашката е плътна, с дълги косми.</personality>
    </cat_breed>
  </cat_breeds>
  <categories>
    <category category_id="cat4">напълно разпознати котки - 4</category>
  </categories>
  <groups>
    <group group_code="groupC">късокосмести котки</group>
  </groups>
</fif>